{"calendar_version":"115-114.07.30-fruit-vegetable","calendar_year":2026,"closed_day_count":80,"content_hash":"sha256:97775f09206973fb5c9f77d9c9777736710ce4a93c6e6e911a59388c53552b55","document_url":"https://www.tapmc.com.tw/webatt/115%E5%B9%B4%E4%BC%91%E5%B8%82%E6%97%A5%E7%A8%8B%E8%A1%A8.pdf?20250820=","entries":[{"calendar_date":"2026-01-01","reason":"年度日程交易日","schedule_status":"expected_open"},{"calendar_date":"2026-01-02","reason":"年度日程交易日","schedule_status":"expected_open"},{"calendar_date":"2026-01-03","reason":"年度日程交易日","schedule_status":"expected_open"},{"calendar_date":"2026-01-04","reason":"年度日程交易日","schedule_status":"expected_open"},{"calendar_date":"2026-01-05","reason":"一般週一休市","schedule_status":"scheduled_closed"},{"calendar_date":"2026-01-06","reason":"年度日程交易日","schedule_status":"expected_open"},{"calendar_date":"2026-01-07","reason":"年度日程交易日","schedule_status":"expected_open"},{"calendar_date":"2026-01-08","reason":"年度日程增休（週四）","schedule_status":"scheduled_closed"},{"calendar_date":"2026-01-09","reason":"年度日程交易日","schedule_status":"expected_open"},{"calendar_date":"2026-01-10","reason":"年度日程交易日","schedule_status":"expected_open"},{"calendar_date":"2026-01-11","reason":"年度日程交易日","schedule_status":"expected_open"},{"calendar_date":"2026-01-12","reason":"一般週一休市","schedule_status":"scheduled_closed"},{"calendar_date":"2026-01-13","reason":"年度日程交易日","schedule_status":"expected_open"},{"calendar_date":"2026-01-14","reason":"年度日程交易日","schedule_status":"expected_open"},{"calendar_date":"2026-01-15","reason":"年度日程交易日","schedule_status":"expected_open"},{"calendar_date":"2026-01-16","reason":"年度日程交易日","schedule_status":"expected_open"},{"calendar_date":"2026-01-17","reason":"年度日程交易日","schedule_status":"expected_open"},{"calendar_date":"2026-01-18","reason":"年度日程交易日","schedule_status":"expected_open"},{"calendar_date":"2026-01-19","reason":"一般週一休市","schedule_status":"scheduled_closed"},{"calendar_date":"2026-01-20","reason":"年度日程交易日","schedule_status":"expected_open"},{"calendar_date":"2026-01-21","reason":"年度日程交易日","schedule_status":"expected_open"},{"calendar_date":"2026-01-22","reason":"年度日程增休（週四）","schedule_status":"scheduled_closed"},{"calendar_date":"2026-01-23","reason":"年度日程交易日","schedule_status":"expected_open"},{"calendar_date":"2026-01-24","reason":"年度日程交易日","schedule_status":"expected_open"},{"calendar_date":"2026-01-25","reason":"年度日程交易日","schedule_status":"expected_open"},{"calendar_date":"2026-01-26","reason":"一般週一休市","schedule_status":"scheduled_closed"},{"calendar_date":"2026-01-27","reason":"年度日程交易日","schedule_status":"expected_open"},{"calendar_date":"2026-01-28","reason":"年度日程交易日","schedule_status":"expected_open"},{"calendar_date":"2026-01-29","reason":"年度日程交易日","schedule_status":"expected_open"},{"calendar_date":"2026-01-30","reason":"年度日程交易日","schedule_status":"expected_open"},{"calendar_date":"2026-01-31","reason":"年度日程交易日","schedule_status":"expected_open"},{"calendar_date":"2026-02-01","reason":"年度日程交易日","schedule_status":"expected_open"},{"calendar_date":"2026-02-02","reason":"一般週一休市","schedule_status":"scheduled_closed"},{"calendar_date":"2026-02-03","reason":"年度日程交易日","schedule_status":"expected_open"},{"calendar_date":"2026-02-04","reason":"年度日程交易日","schedule_status":"expected_open"},{"calendar_date":"2026-02-05","reason":"年度日程交易日","schedule_status":"expected_open"},{"calendar_date":"2026-02-06","reason":"年度日程交易日","schedule_status":"expected_open"},{"calendar_date":"2026-02-07","reason":"年度日程交易日","schedule_status":"expected_open"},{"calendar_date":"2026-02-08","reason":"年度日程交易日","schedule_status":"expected_open"},{"calendar_date":"2026-02-09","reason":"一般週一休市","schedule_status":"scheduled_closed"},{"calendar_date":"2026-02-10","reason":"年度日程交易日","schedule_status":"expected_open"},{"calendar_date":"2026-02-11","reason":"年度日程交易日","schedule_status":"expected_open"},{"calendar_date":"2026-02-12","reason":"年度日程交易日","schedule_status":"expected_open"},{"calendar_date":"2026-02-13","reason":"年度日程交易日","schedule_status":"expected_open"},{"calendar_date":"2026-02-14","reason":"年度日程交易日","schedule_status":"expected_open"},{"calendar_date":"2026-02-15","reason":"年度日程交易日","schedule_status":"expected_open"},{"calendar_date":"2026-02-16","reason":"節前／節慶交易，取消原週一休市","schedule_status":"exceptional_open"},{"calendar_date":"2026-02-17","reason":"春節初一至初五休市","schedule_status":"scheduled_closed"},{"calendar_date":"2026-02-18","reason":"春節初一至初五休市","schedule_status":"scheduled_closed"},{"calendar_date":"2026-02-19","reason":"春節初一至初五休市","schedule_status":"scheduled_closed"},{"calendar_date":"2026-02-20","reason":"春節初一至初五休市","schedule_status":"scheduled_closed"},{"calendar_date":"2026-02-21","reason":"春節初一至初五休市","schedule_status":"scheduled_closed"},{"calendar_date":"2026-02-22","reason":"年度日程交易日","schedule_status":"expected_open"},{"calendar_date":"2026-02-23","reason":"節前／節慶交易，取消原週一休市","schedule_status":"exceptional_open"},{"calendar_date":"2026-02-24","reason":"年度日程交易日","schedule_status":"expected_open"},{"calendar_date":"2026-02-25","reason":"正月初九天公生（禁屠日）休市","schedule_status":"scheduled_closed"},{"calendar_date":"2026-02-26","reason":"2月23日取消休市之補休","schedule_status":"scheduled_closed"},{"calendar_date":"2026-02-27","reason":"年度日程交易日","schedule_status":"expected_open"},{"calendar_date":"2026-02-28","reason":"年度日程交易日","schedule_status":"expected_open"},{"calendar_date":"2026-03-01","reason":"年度日程交易日","schedule_status":"expected_open"},{"calendar_date":"2026-03-02","reason":"節前／節慶交易，取消原週一休市","schedule_status":"exceptional_open"},{"calendar_date":"2026-03-03","reason":"年度日程交易日","schedule_status":"expected_open"},{"calendar_date":"2026-03-04","reason":"元宵節後循例休市","schedule_status":"scheduled_closed"},{"calendar_date":"2026-03-05","reason":"元宵節後循例休市","schedule_status":"scheduled_closed"},{"calendar_date":"2026-03-06","reason":"年度日程交易日","schedule_status":"expected_open"},{"calendar_date":"2026-03-07","reason":"年度日程交易日","schedule_status":"expected_open"},{"calendar_date":"2026-03-08","reason":"年度日程交易日","schedule_status":"expected_open"},{"calendar_date":"2026-03-09","reason":"一般週一休市","schedule_status":"scheduled_closed"},{"calendar_date":"2026-03-10","reason":"年度日程交易日","schedule_status":"expected_open"},{"calendar_date":"2026-03-11","reason":"年度日程交易日","schedule_status":"expected_open"},{"calendar_date":"2026-03-12","reason":"年度日程交易日","schedule_status":"expected_open"},{"calendar_date":"2026-03-13","reason":"年度日程交易日","schedule_status":"expected_open"},{"calendar_date":"2026-03-14","reason":"年度日程交易日","schedule_status":"expected_open"},{"calendar_date":"2026-03-15","reason":"年度日程交易日","schedule_status":"expected_open"},{"calendar_date":"2026-03-16","reason":"一般週一休市","schedule_status":"scheduled_closed"},{"calendar_date":"2026-03-17","reason":"年度日程交易日","schedule_status":"expected_open"},{"calendar_date":"2026-03-18","reason":"年度日程交易日","schedule_status":"expected_open"},{"calendar_date":"2026-03-19","reason":"年度日程交易日","schedule_status":"expected_open"},{"calendar_date":"2026-03-20","reason":"年度日程交易日","schedule_status":"expected_open"},{"calendar_date":"2026-03-21","reason":"年度日程交易日","schedule_status":"expected_open"},{"calendar_date":"2026-03-22","reason":"年度日程交易日","schedule_status":"expected_open"},{"calendar_date":"2026-03-23","reason":"一般週一休市","schedule_status":"scheduled_closed"},{"calendar_date":"2026-03-24","reason":"年度日程交易日","schedule_status":"expected_open"},{"calendar_date":"2026-03-25","reason":"年度日程交易日","schedule_status":"expected_open"},{"calendar_date":"2026-03-26","reason":"年度日程增休（週四）","schedule_status":"scheduled_closed"},{"calendar_date":"2026-03-27","reason":"年度日程交易日","schedule_status":"expected_open"},{"calendar_date":"2026-03-28","reason":"年度日程交易日","schedule_status":"expected_open"},{"calendar_date":"2026-03-29","reason":"年度日程交易日","schedule_status":"expected_open"},{"calendar_date":"2026-03-30","reason":"一般週一休市","schedule_status":"scheduled_closed"},{"calendar_date":"2026-03-31","reason":"年度日程交易日","schedule_status":"expected_open"},{"calendar_date":"2026-04-01","reason":"年度日程交易日","schedule_status":"expected_open"},{"calendar_date":"2026-04-02","reason":"年度日程交易日","schedule_status":"expected_open"},{"calendar_date":"2026-04-03","reason":"年度日程交易日","schedule_status":"expected_open"},{"calendar_date":"2026-04-04","reason":"年度日程交易日","schedule_status":"expected_open"},{"calendar_date":"2026-04-05","reason":"清明節循例休市","schedule_status":"scheduled_closed"},{"calendar_date":"2026-04-06","reason":"清明節循例休市","schedule_status":"scheduled_closed"},{"calendar_date":"2026-04-07","reason":"年度日程交易日","schedule_status":"expected_open"},{"calendar_date":"2026-04-08","reason":"年度日程交易日","schedule_status":"expected_open"},{"calendar_date":"2026-04-09","reason":"年度日程交易日","schedule_status":"expected_open"},{"calendar_date":"2026-04-10","reason":"年度日程交易日","schedule_status":"expected_open"},{"calendar_date":"2026-04-11","reason":"年度日程交易日","schedule_status":"expected_open"},{"calendar_date":"2026-04-12","reason":"年度日程交易日","schedule_status":"expected_open"},{"calendar_date":"2026-04-13","reason":"一般週一休市","schedule_status":"scheduled_closed"},{"calendar_date":"2026-04-14","reason":"年度日程交易日","schedule_status":"expected_open"},{"calendar_date":"2026-04-15","reason":"年度日程交易日","schedule_status":"expected_open"},{"calendar_date":"2026-04-16","reason":"年度日程交易日","schedule_status":"expected_open"},{"calendar_date":"2026-04-17","reason":"年度日程交易日","schedule_status":"expected_open"},{"calendar_date":"2026-04-18","reason":"年度日程交易日","schedule_status":"expected_open"},{"calendar_date":"2026-04-19","reason":"年度日程交易日","schedule_status":"expected_open"},{"calendar_date":"2026-04-20","reason":"一般週一休市","schedule_status":"scheduled_closed"},{"calendar_date":"2026-04-21","reason":"年度日程交易日","schedule_status":"expected_open"},{"calendar_date":"2026-04-22","reason":"年度日程交易日","schedule_status":"expected_open"},{"calendar_date":"2026-04-23","reason":"年度日程增休（週四）","schedule_status":"scheduled_closed"},{"calendar_date":"2026-04-24","reason":"年度日程交易日","sche